,Post Title,Comments
143,"New to Arma 3. What are some ESSENTIAL settings to change to improve performance, mods to download et cetera.","Some people are just really sensitive to it.  I never actually notice it unless I'm playing a game that's getting like 100 fps or something.  And if arma was hitting that kind of performance, I wouldn't have any trouble turning it on I don't think. "
144,"New to Arma 3. What are some ESSENTIAL settings to change to improve performance, mods to download et cetera.","Funny thing, I am very prone to motion sickness and Arma 3 is one of the only games I play where I don't have any issues whatsoever. Good for me yaay!"
145,"New to Arma 3. What are some ESSENTIAL settings to change to improve performance, mods to download et cetera.",I've got one =)
146,"New to Arma 3. What are some ESSENTIAL settings to change to improve performance, mods to download et cetera.",I think you just conviced me to finally get one...my aging gaming notebook has a little trouble with ARMA 3.
147,"New to Arma 3. What are some ESSENTIAL settings to change to improve performance, mods to download et cetera.","So, what would happen if I installed these mods, and then joined a coop mission with a couple friends? Would I get booted?"
148,"New to Arma 3. What are some ESSENTIAL settings to change to improve performance, mods to download et cetera.",I was on my phone and I cant save the comment(i think). So I posted this so i can find it when i am home. 
149,"New to Arma 3. What are some ESSENTIAL settings to change to improve performance, mods to download et cetera.","Even without arma 3 considered, it'll be the best upgrade you can buy for an aging machine.  Hell, it's one of the best you can buy for a newly built machine. 

I will suggest this though, when you install it.  Don't ghost your data from the HDD to the SSD.  I tried this, assuming it would be fine due to the SSDs inability to be affected by fragmentation.  And at the time, I did think it was fine, as it was already a huge upgrade over my HDD.  But I realized much later that doing it like that took away roughly 40% of the drive's performance.  

Always do a fresh install. "
150,"New to Arma 3. What are some ESSENTIAL settings to change to improve performance, mods to download et cetera.","It depends on if the 'server' is checking keys or not.  If you're running the mission from your PC or another's, there likely wouldn't be any indication outside of possible script errors popping up once or twice and a lot of .rpt spam.  For instance, if you start a coop mission from your PC and others join it while you're running say.. refined vehicles, and they're not, there wouldn't be a huge problem.  Your vehicle physics would use the mod values, while the other players would use vanilla.   But if you were to use one of the custom cars that Red Phoenix includes, it would probably be invisible to other players.  

On the other hand, if you were to try joining a dedicated server that didn't have these mods keyed up, it'd simply kick you.  It might tell you what the offending addon is, it might not.  
"
151,ARMA 3 Reddiquette,[deleted]
152,ARMA 3 Reddiquette,I'm ok with it. :) 
153,ARMA 3 Reddiquette,"I'm not sure though, but you should look in /r/findaunit, i'm not familiar with the posting rules though, but this should be the right sub to promote your unit."
154,ARMA 3 Reddiquette,[deleted]
155,ARMA 3 Reddiquette,yes you can post info about your group here I used to run 48MI till i left and just started a steam gaming community EIGS 
156,ARMA 3 Reddiquette,Cool thanks for the tips. I'll keep this post up because I think it's good if people have other questions or contributions to ARMA 3 etiquette.
157,ARMA 3 Reddiquette,this. this is also a good way to show a little bit your play style so people have a better understanding of the type of players you're looking for. 
158,ARMA 3 Reddiquette,"Typically in these situations, it's just one guy or another who came from an old clan with a few of his old clanmates.  They get neck deep in another clan, annoyed with the fact that they're outranked, and then break off, convincing as many as he can to follow suit.  

When you dig into the history of some of the oldest gaming groups, you'll see this has happened quite a bit more than expected.  "
159,ARMA 3 Reddiquette,"Without going into too much detail, it was just a difference of opinion between certain commanders. It's in the past now and we are doing well."
160,Arma 3 and laptops,"Prior to my friend having his PC sent from KC, he used an ASUS RoG laptop that ran arma 3 great. You should be fine.

You will need more harddrive space. If you don't have the cash to upgrade your ssd, a 3.0 USB external hdd will work fine, you just need to set up your download locations on steam.

ALSO, to anybody using a laptop for gaming. Buy a laptop fan. It sits under your laptop and blows cool air from the bottom. Your laptop WILL get hot and sluggish without it. They are fairly cheap so I would get it asap."
161,Arma 3 and laptops,Well I have a 1tb internal hd that isn't ssd. I figured I would install arma on the 150g ssd and anything else on the internal 1tb. Thoughts?
162,Arma 3 and laptops,"Sounds good.. It really just helps with load time man.. If you got the space, great.. But really ssd just makes whatever's on it get loaded a lot faster.. But not necessary at all.. I've got the bigger and more graphically intense textured games on ssd .. And there's a definite advantage over regular HDD but if you don't mind a loading screen for an extra 10-20 seconds.. Who gives a shit"
163,Arma 3 and laptops,"If you can get arma 3 on your ssd, great. ArmA continuously streams information from your hd during gameplay but other than initial load times it won't be all that noticeable so I wouldn't sweat it if you need to move it to your 1TB drive.

Did you get that laptop fan yet?"
164,Arma 3 and laptops,"no i havent... all the ones on the market say for laptops up to 17"" and mine is 17.3"" i dont think the dimensions will work.. i might have to get a 18 or 19"" fan.. any recommendations ? 
"
165,Arma 3 and laptops,"17"" will be fine. Its not going to clip on or anything, the laptop just sits on top of the fan. Duel fans are ideal."
166,Help finding game mode,I'm pretty sure it's called ZvZ (Zeus vs Zeus) 
167,Arma 3 Beginner Guide,"* [playlist for videos](http://radd.it/r/arma3/comments/24iyzq/video) in this post ([mobile](http://m.radd.it/r/arma3/comments/24iyzq/video))  

*^Downvote ^if ^unwanted, ^comment ^will ^be ^removed ^if ^score ^is ^0.*  
[^about ^this ^bot](/1vjdw9) ^| [^recent ^playlists](/r/radditplaylists) ^| [^plugins ^that ^interfere](/1m21ku) ^| [^request ^blacklist](/message/compose/?to=radd_it&subject=Please blacklist&message=Please add me to the /u/PlaylisterBot blacklist. You can find my favorite pic of Emma Watson at: )"
168,"Scripting Help, please.",Could someone please lend me a hand?
169,Arma 3 Roadmap 2014/15,"It's refreshing to have a developer highlight what they are doing/attempting to do on a regular basis, adding more gameplay features and content and involving the community, before paid expansions are thrown our way or gouging us for paid fixes and content.
I hope this includes bipods and weapon resting though!"
170,Arma 3 Roadmap 2014/15,Finally the helicopters are being updated. Many many people are gonna love this.
171,Arma 3 Roadmap 2014/15,This deserves the front page of the internet.
172,Arma 3 Roadmap 2014/15,Is anyone else just holding out for ARMA3:Project Reality ?
173,Arma 3 Roadmap 2014/15,"Sounds great, but still nothing about driving mechanics? Maybe it's just me, but I feel like driving vehicles is worse than in Arma 2. It just doesn't feel very good, at all.

I mean I love the game and of course I'll continue playing it, but I really heavily dislike vehicles in Arma 3."
174,Arma 3 Roadmap 2014/15,I am certainly one of them.  can't wait to see what they do. 
175,Arma 3 Roadmap 2014/15,I'll take the no replies and the one downvote as a no then ;).
176,Arma 3 Roadmap 2014/15,"I think it's significantly better, I used to play a lot of DayZ mod and the driving was awful

In Arma 3 it's quite fun and very easy to control the vehicles "
177,Arma 3 Roadmap 2014/15,Agreed.
178,Arma 3 Roadmap 2014/15,"I'm in the other camp, I think the vehicle mechanics are a lot better in Arma 3. It definitely does need work, though, because even on my machine - which is no slouch - I experience obvious stutters while driving. Doesn't matter what the situation is. Input response is slow, too.

Having said that, however, the addition of working suspension to vehicles, better collision, and stats integrity (like the fuel tank not being the size of a timble) are all improved, in my opinion."
179,Arma 3 Roadmap 2014/15,"In Arma 2, you could steer with a mouse, which was weird at first, but after a couple of sessions, I got used to it and found it to be very smooth and accurate.

This option doesn't exist in Arma 3 anymore, unless I'm too stupid to find it. Well, you can use a mouse, but then the steering is just completely broken.

On top of that, the vehicles still feel like feathers. Driving just feels cheap, and it's far from being realistic. 

It's just not on par with flying or infantry movement, and Bohemia doesn't even talk about it.

"
180,Arma 3 Roadmap 2014/15,"I think in Arma 2, unless you were using a real steering wheel, the mouse was the best option for this. I remember disliking it at first as well, because I was using A and D or the arrow keys for it, but with the mouse, it was very smooth and accurate. There were still various other issues, of course, but it felt relatively good.

In Arma 3, I have to quickly tap A or D for subtle steering. That's just not what I want to do in a simulation game. And you could say that, well, get a steering wheel. But no. It worked in Arma 2, and I think that the mouse actually a very legitimate option, that should be available in Arma 3 as well. So that's my first criticism. (I say this every time; if this option actually exists and I'm just too stupid to find it, pls tell me. I know that you can bind steering to the mouse, but it doesn't work like in Arma 2. At least not for me)

The second one is that vehicles just have zero mass and feel anything but realistc. They feel like feathers and this in conjunction with the point above completely kills the fun for me.

And that bothers me. Because I love the game and I usually enjoy driving in games. But Armas driving mechanics just feel cheap. And Bohemia doesn't even talk about it.

I guess saying that it's worse is a bit of an exaggeration, but it just does not feel like it's supposed to in a simulation. And last I checked, vehicles were a big part of the military."
181,Arma 3 Roadmap 2014/15,"I never used the mouse, it just didn't work for steering in any version of arma for me

I find I'm much more accurate with the keyboard

Flying is another matter, that I do use the mouse for"
182,Arma 3 Roadmap 2014/15,Try plugging in a game controller.  Then you can steer with an analog stick.
183,Arma 3 Roadmap 2014/15,"But steering with a mouse works pretty much the same like with a real steering wheel. You move it a certain distance, and then once you release it, it centers on its own. A keyboard will never be as accurate as this. I understand that with a mouse it might feel awkward but it makes for a more realistic driving, and maybe I sound like a weidro, but that's what a simulation is supposed to be.

I'm sorry if this sounds like I'm a whiny, hating kid. I'm not. I'm just getting a bit frustrated, because the driving mechanics or rather vehicles in general, aren't as good as other parts of the game, even though they should be. Vehicles are a big part of the military, but to me it seems like Bohemia kind of ignore them :("
184,Arma 3 Roadmap 2014/15,[deleted]
185,Arma 3 Roadmap 2014/15,It's realistic enough for the military who purchased the larger version of it for Battlespace or whatever they call it.  How is it not a simulation?  It's hands down more realistic than any simulation that was out 10 years ago.
186,Arma 3 Roadmap 2014/15,"VBS3 is the military version, Virtual Battle Simulator, imagine Arma with more care for accuracy and less for Playability. (as far as im aware, i havent used it, only seen ""game""play footage)"
187,Arma 3 Roadmap 2014/15,Vbs is nothing like arma. Arma is getting designed as a game more and more. Vbs is a pure simulation program 
188,Arma 3 Roadmap 2014/15,"Why don't you run down some of the differences?

>Arma is getting designed as a game more and more.

Arma is the same engine marketed as an entertainment product."
189,Arma 3 Roadmap 2014/15,"It came from the same engine. It is no longer the same engine. That doesn't mean it behaves in the exact same way. They are completely separate companies with their own teams, goals and costumers. It has nothing to do with 'larger version'. VBS used completely different assets. VBS has better vehicle simulation. VBS has better damage simulation (and wounding systems). VBS is designed to set up realistic scenarios with a 3D editor and has payed extensions and editors for it. VBS does slightly different rendering. VBS exists purely out of 'real' stuff. VBS3 will use dynamic biomes. VBS can handle structures going underground (Make a house with a cellar, plop up down somewhere and it lets you walk under the terrain properly). 

Need I go on? Its like saying Need for Speed and Battlefield are the same game. They have the same publisher (ArmA and VBS do not). They both use the Frostbite engine (Exact different I don't know). Making a gaming authentic doesn't make it a simulation. "
190,Arma 3 Roadmap 2014/15,"These all sound like things that could be rolled into the A3 engine, except perhaps the underground..."
191,Scripting Question?..simple,[deleted]
192,Scripting Question?..simple,Its resolved now thank you for replying.
193,Creating respawns with Zeus?,"you did it right, but on single team you dont even need to add tickets
"
194,Creating respawns with Zeus?,Were you playing in single player?  There's no respawn action in Singleplayer. 
195,Arma 3 Terminal Ballistics - I didn't even know Arma 3 simulated bullets this well! This is just awesome job by Bohemia! And the youtube guy for showing us as well!,"You guys should join the ""*official/real*"" arma3 subreddit /r/arma  
  
There's over 13 000 people there and the guy who made this video is a frequent visitor and part of the BIS team now :)"
196,Arma 3 Terminal Ballistics - I didn't even know Arma 3 simulated bullets this well! This is just awesome job by Bohemia! And the youtube guy for showing us as well!,Thank you Youtube guy! :)
197,Arma 3 Terminal Ballistics - I didn't even know Arma 3 simulated bullets this well! This is just awesome job by Bohemia! And the youtube guy for showing us as well!,"Thats good.
However I knew it before, seen this vid before actually. And there is a mod in Workshop in Steam where u can load this mission by yourself and test it out.
"
198,Arma 3 Terminal Ballistics - I didn't even know Arma 3 simulated bullets this well! This is just awesome job by Bohemia! And the youtube guy for showing us as well!,thanks!
199,Wallpaper: One Away,"Very nice.
Thanks!"
200,pawnee minigun fps lagg?,We had this problem last night in session to where it caused players to drop to almost 5 fps. Supposedly it is due to splitting the ammo types and the config decided it wanted break. 
201,pawnee minigun fps lagg?,"the king of the hill config? think they will fix it? makes it almost unplayable 
"
202,USEC is hosting three public sessions! First mission 2nd of May - UPRISING,"Description says no mods required, but are there server compatible mods such as VTS resting or JSRS?"
203,USEC is hosting three public sessions! First mission 2nd of May - UPRISING,"due to server issues, we haven't been able to enable any mods

tl;dr no mods whatsoever"
204,Server / Zeus help.,We all deleted our profiles and made new ones now everything works... doesn't make sense right away but oh well.
205,Server / Zeus help.,just restart server to fix this.
206,Server / Zeus help.,We tried that a numerous other things before arriving to the solution.
207,Arma 3: A Better life Mod ”Lost Isles”,any footage?
208,Arma 3: A Better life Mod ”Lost Isles”,This looks cool but Arma3Life is still got my ticket
209,Arma 3: A Better life Mod ”Lost Isles”,We're working on getting some footage together.
210,793.5 mb update. Is there any description for it?,Hellcat guns ruin the whole server (massive lag/latency) for all player on Sa-matra king of the hill. 
211,793.5 mb update. Is there any description for it?,Here it is http://dev.arma3.com/spotrep-00024
212,793.5 mb update. Is there any description for it?,"I know that it updates Zeus and a few other things here and there, such as UAVs and the like, but 793 mb is still pretty large. Dunno', man."
213,793.5 mb update. Is there any description for it?,Changelog: http://dev.arma3.com/techrep-00008
214,793.5 mb update. Is there any description for it?,"Thats pretty troubling, seeing as optimization is their focus."
215,793.5 mb update. Is there any description for it?,Thanks yo.
216,793.5 mb update. Is there any description for it?,"That's for the ArmA 3 Tools, not for the main game."
217,793.5 mb update. Is there any description for it?,"Yeah it is. I reckon it must be either: Client and host mismatched (if servers werent updated but clients were), new bug they missed got in or sa-matra need to integrate something differently with these changes. "
218,793.5 mb update. Is there any description for it?,"I dont think its just Sa-Matra. I play King of The Hill on Hostile Takover, same issues over there. Straight up unplayable at the moment."
219,793.5 mb update. Is there any description for it?,Ahh ok. Yeah the only 100% repro I got was on S-M KoH Hellcat firing. Didnt try any other servers or modes cos im not at fucking work :D
220,What would you do in this situation?,He's a tactical genius.
221,Preformance tips for laptop user,"I know you've probably been told this before, but ArmA games do not run particularly well on laptops. Yeah, you could maybe get away with it on ArmA II, but ArmA III is not gonna take your laptop kindly. It's simply that laptops cannot host the resources needed to handle a game like ArmA III very well - it's well known that ArmA III is very CPU intensive, runs on an outdated engine, and is not completely optimized yet. If you want to get anything more than 25 FPS max, you're going to have to use a desktop.

I know, it's not fair that ArmA 3 does this, but we can't do anything to fix it unfortunately. "
222,Activating mods for Zeus,The first release wasn't Zeus compatible. Make sure you have the latest version.
223,Activating mods for Zeus,"I got the latest but the only model I can set as Zeus is 'WAP Base' and if I set it, the game crashes."
224,Please tell me there is a way.,"AFAIK there is no way to filter out Altis life while keeping every other server. On the rare occasion I decide to look for servers besides the 5 I currently play on, I filter by game type and flip between coop, ctf, king of the hill, etc... I forget which type Life is under but I just change the type again and continue browsing."
225,Please tell me there is a way.,"what you can do is just run filters for mission types you DO want is the ""mission"" filter, which is helpful for doing what you're saying with the additional perk of being able to find exactly what you're looking for.

tl;dr just search for what you do want."
226,Please tell me there is a way.,There is a way
227,Please tell me there is a way.,Please tell me this isn't a lie if it isn't a lie...
228,Please tell me there is a way.,It isn't a lie.
229,Please tell me there is a way.,Well I am sure you could make a script or something to do it.
230,Sniping the pilot of a Armed Orca on Wasteland,LOL he just falls off
231,Sniping the pilot of a Armed Orca on Wasteland,"so, out of curiousity, is this feasible IRL? I'd imagine that glass would be fairly .. well, bulletproof, given their purpose?"
232,Sniping the pilot of a Armed Orca on Wasteland,"pilots who use a mouse to fly, easy as hell to kill"
233,Sniping the pilot of a Armed Orca on Wasteland,Ohemgee kewl vid dewd
234,Sniping the pilot of a Armed Orca on Wasteland,"true, he wasn't flying very well haha"
235,Sniping the pilot of a Armed Orca on Wasteland,Thats a pretty sweeping statement.  I'm a very successful Arma pilot and I use the mouse.
236,Sniping the pilot of a Armed Orca on Wasteland,Guys who use joysticks in wasteland are taking it way too seriously.
237,Sniping the pilot of a Armed Orca on Wasteland,lol thanks man
238,Sniping the pilot of a Armed Orca on Wasteland,"its like saying fat people cant run fast, some may, but most cant

if it would make you happy i could rephrase it to fit your little need for it to be expect and it could say something along the lines of

most pilots who decide to use a mouse over a joystick are most of the time a worse pilot and make more mistakes then a equality skilled joystick pilot"
239,Sniping the pilot of a Armed Orca on Wasteland,"i dont think it has to do with the gamemode, more of just flying overall is much better with a joystick"
240,Sniping the pilot of a Armed Orca on Wasteland,"I think a better way of phrasing it would be:

""Pilots who use auto-hover to fly are easy as hell to kill.""

Considering he was blatantly using it."
241,Sniping the pilot of a Armed Orca on Wasteland,"almost any decent pilot who uses a joystick never uses autohover unless you need to pick something up, almost every mouse pilot i know uses it for combat or for landing"
242,ArmA 3 - Surrounded Equals Fun [ALiVE],"We're recruiting, [Apply Here] (http://steamcommunity.com/groups/lyn_at_a3)

http://alivemod.com/war-room/showorbat/377

GMT+8 South East Asian ALIVE group

"
243,"Please direct all 'Life' posts to the new Subreddit, created just for Lifers!",i dont see why there is a reason for a seperate subreddit considering how tiny the arma one already is
244,"Please direct all 'Life' posts to the new Subreddit, created just for Lifers!",Subreddit closed due to unintentionally 'dividing the community'. Apologies for any harm caused.
245,"Please direct all 'Life' posts to the new Subreddit, created just for Lifers!",Vote up if you're sick of 'Life' posts clogging up the arma3 subreddit.
246,"Please direct all 'Life' posts to the new Subreddit, created just for Lifers!",Would this not just reduce the overall traffic to an already quiet sub? 
247,"Please direct all 'Life' posts to the new Subreddit, created just for Lifers!","yes it would, and thats why this guy should go away with his division of the community crap.

Hes trying to divide an already small enough community.   Hell most of the time i think an A3 subreddit is completely unnecesarry, as we already have /r/arma, but *this guy* here thinks its important to segregate the community based upon gameplay styles and game modes, since the majority of people at /r/arma have no interest in seeing altis life crap.    Though its not that some dont want to see that stuff, its that the majority dont, and he cant take getting downvoted to get his content out there for people to see.

Please stop trying to divide things toxic.    If the only thing you are worried about when posting to the arma subs is how many upvotes and downvotes you get, you probably shouldnt contribute to begin with, and if that isnt what you are trying to mitigate then why?    

There are never enough new posts to /r/arma to justify the claim that no one will see your content because of downvoting.    Anyone that hits the new tab or spends more than a few minutes on it will see the whole days content and have the opportunity to par rouse it.

this is bad for the community as a whole to try and divide it.   "
248,"Please direct all 'Life' posts to the new Subreddit, created just for Lifers!","What can I say to your outrage toaster...

You are the one that seems to be hung up on up/downvotes. I have never posted anything about Altis Life. I'm not really a fan TBH. 

Did you go this nuts when *this* subreddit was created? If so, you might wanna loosen the reigns a little."
249,"Please direct all 'Life' posts to the new Subreddit, created just for Lifers!","I didnt even know this sub was created until a couple months ago.   

ive also stated already that i dont think it was necessary, but yes ill happily speak out to stop yet ANOTHER sub from popping up for no damned reason.

but yes, you are obviously hung up on the upvotes and downvotes seeing as you expressly stated that you wanted to give a home to people to post content about life servers without incurring the downvote wrath of the hardcore players.

i guess im just sad that your first reaction is to create another sub and divide the already limited content, instead of just try again.    People will see the content, and come back for it, downvotes or no."
250,"Please direct all 'Life' posts to the new Subreddit, created just for Lifers!","It's because (even though I'm not a Life player) Lifers post reasonable content, but because the 'hardcore' arma players see it as being 'not truly Arma', it's downvoted straight away, which is not fair to them.

I was just trying to give them an outlet where it would be more appreciated. Given the fact that you believe the Arma community is already too small, maybe there is a bigger problem other than another subreddit."
