,Post Title,Comments
251,"Please direct all 'Life' posts to the new Subreddit, created just for Lifers!","there is.   mistreatment of the downvote button.

if it were actually possible to remove it altogether i would vote for doing so.

and no it isnt fair, but it happens to all of us.    seriously... i cant post a video these days without it going negative in the first 10 minutes... and i post the ""hardcore"" content.  

it is happening to everyone.   if people would just ignore the damn downvotes and stop worrying about their kharma score, we would see a plethora of content here we dont normally.

i sincerely fucking hate reddits voting system.      

if you didnt notice once people piped up about videos being boring and all that gets posted here, it started changing, it went a little extreme.   Now hardly anyone can post a mission vid without it getting downvoted to oblivion. 

i do it anyway...   they still get WAY more views than they would if i didnt."
252,"Please direct all 'Life' posts to the new Subreddit, created just for Lifers!","I'll agree with you there mate. At least get rid of the downvote, people hit that before they even look at the content."
253,"Please direct all 'Life' posts to the new Subreddit, created just for Lifers!","yes they do.    Its not good.

but again, if people posted and stopped worrying about the downvotes, you would find an audience, and it would change."
254,New to A3 - Where do I begin?,"My opinion would be to play the campaign. A buddy that just started (no arma experience before) said it really helped him learn the game and understand the naming of things.


And as for scifi , all the guns are not much different than current weapons. Besides a cosmetic difference."
255,New to A3 - Where do I begin?,"Try out something like king of the hill or maybe domination""invade and annex"". I'm not over keen on the whole role playing side too I mainly stick to domination and wasteland and playing the single player campaign every now and again."
256,New to A3 - Where do I begin?,"Ok so I have discovered that Zeus mode is amazing, and that bennys warfare is amazing. All the prepackaged zeus maps are horrid in that you cant play in them, so I cracked open the editor and made one where I could. Looked into making a respawn point and all involved, and from what I could tell I need to get tools to unpack PBOs. How would I go about setting up zeus game controls in bennys warfare & also virtual ammo boxes? Also, what tools are best?"
257,Need help with adding add-ons to a mission.,"Not possible my friend.

Scripts, yes. But not things that aren't in vanilla. They will have to be downloaded by everyone that plays it."
258,Need help with adding add-ons to a mission.,"Seeing as you don't have many responses, try [/r/armadev](http://reddit.com/r/armadev) . They know stuff"
259,Need help with adding add-ons to a mission.,"It is possible. I have seen it, just don't know how to implement it. MCC's mission on the Steam Workshop doesn't require you to download the mod but you are still able to use MCC in the mission as well as everyone who enters the server. "
260,Need help with adding add-ons to a mission.,"I'll try, thanks."
261,Need help with adding add-ons to a mission.,Isn't MCC just a load of scripts/images/audio? I switched from the mod to the mission so other wouldn't have to install it. But I can't think of any part of it that's not vanilla extras.
262,Need help with adding add-ons to a mission.,"That was an example. I would have just used the mission file if I wanted that. I would really like to add this vehicle. I've read that you need to unpack the pbo of the mod and put it in the mission pbo but that didn't seem to work. I think I need a string to define the mod first.
"
263,Video compilation April 2014 of CAA,All scenes were taken from the official missions of the Comunidad Americana de Arma
264,[A3] Cerberus Addon for Arma 3,How about a link to ... something? What is the status of the project? Who is working on the team?
265,[A3] Cerberus Addon for Arma 3,">NEW Medical System GUI (Uses Arma 3 Vanilla medical control system)

Yes please. Looks cool though, an addon that contains a custom campaign and nice additions. Note that once ACE3 comes out, some of your changes (medical, map functions) may be replaced with ACE3's, and create redundancy. That may push some away from your addon. You may want to release a version with the medical system, and a version without."
266,[A3] Cerberus Addon for Arma 3,"ARMA: MAKE ARMA NOT WAR entry has been submitted, 

Link: http://makearmanotwar.com/entry/44UAvxwty8#.U2DQ3PldUrI

Please support and vote for Cerberus

Regards,

Bull"
267,[A3] Cerberus Addon for Arma 3,"The project was started about 2 weeks ago and its making very steady progress. A lot of features like the extended 3D editor are in but need heavy testing. The medical system has all the UI and icons implemented, we now just need to decided on the damage states ect. I'm also sure bull has done a lot of work on the campaign.

As for the team Bull is currently doing all the work but I will be stepping in soon to do a lot of the medical system code and other realism features once the UI is ready.

To sum up what Bull as said:

This mod will be a huge addon to arma 3 that will give more freedom and features into the creation of missions. Most importantly it will add more features to make the game more realistic, fun and immersive (for example the medical system).

"
268,[A3] Cerberus Addon for Arma 3,"Here is a link to a zeus embedded mission

http://i.imgur.com/CwL3t1Z.png

This is going to be the sort or artistic style with the mod. im trying to go for the look BI set out to make it seem as though this mod is just an extension of the game

Here is a link to some of the medical icons

http://imgur.com/a/SVXVx

Here is the link to the Imgur album

http://imgur.com/a/TpFY7

Hope that wets your appetite

Bull"
269,[A3] Cerberus Addon for Arma 3,[This forum post](http://forums.bistudio.com/showthread.php?176905-Arma-3-CERBERUS&p=2677475) is all I could find... I hope to see more content soon.
270,[A3] Cerberus Addon for Arma 3,"medical system will be a separate module that you can use if you want, it will not be forced. wich means that the mod should be compatible with ACE3, however if this is not the case, im hoping that if the mod is sucessful, then i will work with the ACE team to ensure that it is"
271,[A3] Cerberus Addon for Arma 3,"Will the medical system work like ACE in Arma 2? Also, will the AI be able to effectively use the medical system?"
272,Core Tactical - An ArmA community that wants you!,What are you folks using as a wounding system for A3? That seems to be the one thing holding me back from wanting to swap.
273,Core Tactical - An ArmA community that wants you!,"For now were both an ArmA 2 and 3 group. 

As far as wounding systems go, we have been looking into a few..but they all seem meh. So for now we're holding off as we wait for a quality one. 

"
274,Battle royale broken?,"I had same issue last night, no bombing zone and rushed to a supply crate for nothing "
275,Battle royale broken?,no bombing zones in my last one either
276,Battle royale broken?,ya ive also been havin these issues. Pretty awesome when you run 800km to a crate and...theres nothin then die cause of it.
277,Battle royale broken?,Haven't played in a week due to work and college. Not looking forward to this... There has been rampant respawning problems when i last played...
278,Battle royale broken?,"I just played a match and ran across two crates with loot.  The prior game I saw another player with a gillie, which I think only spawn in crates, so this issue may be fixed."
279,Battle royale broken?,"Yup, and the game ends with 2 to 3 people left. "
280,Anyone with similar specs?,"I had a 5850 for maybe a year and it did a good job on Arma (replaced with GTX770 a month ago). My bottleneck was my old Q8400 CPU, replaced it with a i5-3570k and it runs perfecly (had to buy new mobo etc). 

Like truent0r said, your CPU will be the bottleneck here, for some reason AMD CPU's have a hard time with Arma (some of them), [Here](http://www.reddit.com/r/arma3/comments/223yk2/upgrading_my_pc_will_this_be_able_to_run_arma3/cgjtzxf) is a reply from a user here i had about this problem.

Other than that you should be fine to play the game, be warned though that in MP some servers have script heavy maps or have low specs, even if you have a killer rig you will be bound to server FPS, there is no way around it even if you adjust your graphics etc. If a server gives you poor FPS then look for another one. Your benchmark should be SP, if you get good FPS in SP then you know that its the MP server that cuts your FPS. Hope this helps."
281,Anyone with similar specs?,"Not gonna be good man.. Maybe single player will be doable but multiplayer not so much. Your CPU benchmark shows 2054, I had 3500 and multiplayer ran like crap until I got a new i5 Intel processor.. If you plan on upgrading soon, id grab it when it goes on sale 30-35$ range.. Then see how it runs, but I wouldn't pay full price for a game thatll most likely be to clunky to play..

Sorry for the bad news.. But I don't want you to spend $60 and have it not be playable.. Good luck brothah"
282,Major lack of servers?,"in the top right of the server browser, try switching to steam listed servers. There was about 2700 last time I checked."
283,Major lack of servers?,I have a weird problem where this will happen to me once in a while. Only maybe 4 or 5 servers will list if any at all whether I list steam or gamespy servers and I have to restart Arma to fix it and get the server browser working. Anything like this happened to you?
284,Major lack of servers?,It worked. Thanks a bunch!
285,Second time playing Battle Royale (the original Hunger Games)... people are awesome.,Haha what the heck? What type of mod is that? I haven't heard of this before
286,Second time playing Battle Royale (the original Hunger Games)... people are awesome.,"Wow, good guy player right there. If it was me I would have shot you and if I was you I would have used that pistol to shoot him.  
  
If I managed to get close enough without shooting for him to actually give me a med kit and act friendly I probably would have stuck with him until the end and then done some sort of 10 pace duel to decide the winner."
287,Second time playing Battle Royale (the original Hunger Games)... people are awesome.,"why do people have to mention hunger games when talking about this game that is clearly named battle royale because it IS NOT hunger games.

ugh, sorry but hunger games is just hollywood crap that should be purged from our collective unconscious. "
288,Second time playing Battle Royale (the original Hunger Games)... people are awesome.,people call it Hunger Games cause its the most recent comparisson to the Mod. You are all on an Island trying to Survive. If you watched the Movie and you try to follow what they teach ur chances are way higher to win
289,Second time playing Battle Royale (the original Hunger Games)... people are awesome.,Battle Royale. you can download from the PlayWithSix player
290,Second time playing Battle Royale (the original Hunger Games)... people are awesome.,"Try it if you haven't, it is a really fun mod. Highly recommended."
291,Second time playing Battle Royale (the original Hunger Games)... people are awesome.,"Not worry friend

this is the game

I do not grudge. "
292,Second time playing Battle Royale (the original Hunger Games)... people are awesome.,"I made the point to call it the original Hunger Games because Battle Royale is quite aged and a lot of things have been made off it's idea (The Condemned, Gamer, Hunger Games). Many people these days will call Battle Royale a rip off of the Hunger Games, hence the way I phrased the title."
293,Second time playing Battle Royale (the original Hunger Games)... people are awesome.,"Any chance you stream some games on Twitch or know of channels that do? I'm really interested in the mod, but right now, my rig doesn't allow me to play anything else than the solo campagin...

Also, what of the rules ? Are they the exact same as in the book, is there a hunger/thirst management ?"
294,Second time playing Battle Royale (the original Hunger Games)... people are awesome.,The feels are back. 
295,Second time playing Battle Royale (the original Hunger Games)... people are awesome.,"Yeah, it is very rare to find someone like that. I found someone that wanted to make a team after we just landed and had no weapons. The instant he got a gun he shot me with it."
296,Second time playing Battle Royale (the original Hunger Games)... people are awesome.,"> Many people these days will call Battle Royale a rip off of the Hunger Games, hence the way I phrased the title.

no they wont.

just ignore hunger games and pretend it doesnt exist."
297,Second time playing Battle Royale (the original Hunger Games)... people are awesome.,"No there isn't thirst or hunger. You basically get dropped out of a plane onto the map with nothing and you have to find guns and gear and stay alive. There are 25-36 other people and the last one alive is the winner. I am just getting into streaming and I usually do so around 10PM. My twitch url is www.twitch.tv/LapseOfSanity  
  
Alternatively if you can only watch during the day I would very highly recommend www.twitch.tv/lirik Lirik is my favorite streamer and watching his stream is what got me into DayZ and BR and all the Arma stuff, without that I wouldn't even know it exists."
298,Second time playing Battle Royale (the original Hunger Games)... people are awesome.,I enjoyed the Hunger Games movies. I'm pretty sure all the young people coming over to Arma have no idea what Battle Royale is.
299,Second time playing Battle Royale (the original Hunger Games)... people are awesome.,"I'll take a look at the channels, cheers man."
300,Second time playing Battle Royale (the original Hunger Games)... people are awesome.,"It basically is the Hunger Games with guns. That movie may have ripped off the original Battle Royale, but that doesn't take away from it. Mention both movies to 10 random people today, I bet all 10 know about the hunger games and maybe 2 will know about battle royale..."
301,Second time playing Battle Royale (the original Hunger Games)... people are awesome.,nothing but an appeal to popularity
302,Second time playing Battle Royale (the original Hunger Games)... people are awesome.,"Awesome :)  
  
I go on around 10PM EST USA time and Lirik usually goes on around noon EST USA time. My bad, usually I specify what zone on here -.-"
303,Second time playing Battle Royale (the original Hunger Games)... people are awesome.,"Don't worry, I've made the calculations anyways, since I'm based on GMT, I have a tendency to do that since I'm on Reddit. ;)"
304,I need a platoon,"Hey buddy, try /r/findaunit. A lot of groups recruit from there and you can really get the pick of the litter. In the mean time, why not check out Task Force Mamba at tfmamba.com and also this link:

http://www.reddit.com/r/FindAUnit/comments/247i4n/a3recruiting_task_force_mamba_air_armor_and/"
305,I need a platoon,"check us out on www.ore-gaming.com we play Arma 3, BF4 and much we also have a youtube where you can see us play its all on the Website same goes for TeamSpeak"
306,I need a platoon,SOCOMD.com for Australian themed gameplay. Apply and we'll give you the details and get you downloading our mods. 
307,I need a platoon,"We're accepting applications as well
www.talonrepublic.com 
We mainly do wasteland and zuess coop stuff"
308,"I bought Arma 3, did i just get scammed?","If you bought it off bohemia's website(don't know if that is even possible) just send their support an email and I am sure they will get you the correct key.  
  
Alternatively, if you bought it off g2a or something the keys there are region specific. I almost bought a Russian key, but decided the site looked a little shady and I just bought it straight off Steam.  
  
So basically, there are different keys for different regions. You just got the wrong one."
309,"I bought Arma 3, did i just get scammed?","So I won't be able to play with my friends here in Sweden on this Australian version? 

On a side note, g2a is pretty legit from my experiance. I have bought games from them before but right now the Arma 3 key was out of stock. I tried out a random site called gamingpanda.net that looked even more shady :) "
310,"I bought Arma 3, did i just get scammed?","As far as I know about Steam regarding region locking, you'll only be able to launch the game through an Australian IP. I found this though, might be of help to you.

---


1: Create a new document in Notepad and click File > Save As and make the File name this:

steam_appid.txt

It's important the .txt is at the end (indicates the file type, but make sure you don't accidentally make it steam_appid.txt.txt).

Inside of the steam_appid.txt should be JUST the following numbers:

107410

For example, if in step 2 your URL was steam://rungameid/107410 , the contents of your steam_appid.txt should be 107410)

Place the new steam_appid.txt file you just created into the Arma 3 folder. By default, it is located at ...\Steam\SteamApps\common\Arma 3

If a file already exists simply overwrite it.

In Steam, click 'Games > Add a Non-Steam game to my Library'. Add the Arma3.exe. By default, it is at ...\Steam\SteamApps\common\Arma 3

You can also start the game by simply clicking Arma3.exe from windows explorer. The game will run without a VPN. 

Hope this helps."
311,"I bought Arma 3, did i just get scammed?","Haha, if I was a betting man I would say that you just bought the wrong region key. I know people that buy from g2a, I just couldn't do it so I went with steam and spent an extra $20 haha.  
  
Try and contact their customer service and see if you can exchange yours for the correct one, not sure how that works for digital product keys though. I suppose there's gotta be a way."
312,"I bought Arma 3, did i just get scammed?","Great tip! Thanks alot, I'm installing the game right now so will definitely try it out later. 

I guess there is no difference when playing a mod like Breaking Point?
"
313,Road trip through Altis in less then 4 mins (Fast Foward),Really cool video the ambient life was a nice touch. Just out of curiosity how long did it take in real time? 
314,Road trip through Altis in less then 4 mins (Fast Foward),"Damn Altis, you're big."
315,Road trip through Altis in less then 4 mins (Fast Foward),"Visually, Altis is one of the, if not the most stunning map I've seen in a game so far. If only the gameplay it provides would be as good.

Anyways, great video. Good choice of music as well :)"
316,Road trip through Altis in less then 4 mins (Fast Foward),It took around 22 minutes. 
317,Performance delta with dedicated PhysX card?,"I really don't think it would make any noticeable difference, as armas physx runs on the CPU only."
318,Performance delta with dedicated PhysX card?,"I have nearly the same setup as you, but a FX 6100 @ 3.9GHz and a GTX 660, so a bit weaker. For me the game runs somehow fine as long as I'm not in multiplayer.

1. I don't know how much you are in the game's engine so forgive me if I assume you don't know: In Arma 3 multiplayer there is nothing you can do about the performance since it is limited to the server performance. Yes, it is really dumb and a relict from the old times of Arma 1 and OFP, and should be at least changed for the next iteration of the game if not patched some day.

2. Also I've noticed that the FX 6100 is really weak even overclocked, which is a real problem since Arma games are heavily dependend on CPU competence. Maybe it is kind of the same with the FX 6300 and therefore your bottleneck as soon as the action starts to show up.

I can't tell too much about my performance in action scenarios because I've primarily been using the game as vacation simulator for the last months^^"
319,Performance delta with dedicated PhysX card?,"I don't understand the engine of this game. I am running a 780ti and if I play battle royale I will average about 100 FPS, switch it to something like king of the hill and it dips to like 50. Definitely still very playable though."
320,Performance delta with dedicated PhysX card?,"Well on my 4670k system with a 7850 I run at between 30 and 70 fps (usually around 40)

While my friends pc with a 2500k and a gtx 760 he gets a solid 60 fps running almost maxed out "
321,Performance delta with dedicated PhysX card?,"balls, i thought it was running APEX for some reason. "
322,Performance delta with dedicated PhysX card?,"TY for the reply. In SP I average over 60fps, but in MP it struggles to maintain 27. I typically see ~30% load on both cpu and gpu which is baffling. I'm hoping that they patch it so I can spread the load across all 6 cores and/or find legitimate hardware for dedicated servers. "
323,Performance delta with dedicated PhysX card?,"oh I'm sorry, i drifted away from the real question. No I don't think you will experience a much better performance as brendanvista already said."
324,Performance delta with dedicated PhysX card?,Frames per second (you) and simulations are second (server) are a different thing.
325,Performance delta with dedicated PhysX card?,What you're describing is the fps lag caused by the server and the only thing you can do about that is buy a real nice server and don't run too many servers on it
326,Performance delta with dedicated PhysX card?,They are both multiplayer modes though. Must be the amount of people vs city or country and what not. It is just a bigger range than I see in other games.
327,Performance delta with dedicated PhysX card?,"Ah. So servers are max capped at 50 SPS (simulation cycles per second). This include all scripts, players info, AI, ballistics, etc. So the more of these you have the slower the server will get.


While the scripting language is easy to learn its is also easy to over complicate cause more SPS issues."
328,Performance delta with dedicated PhysX card?,"So basically you are saying that your FPS is at least somewhat dependent on the server you are in? I have seen some latency issues that make a game look like a slideshow(I am looking at you World of Warcraft) but that doesn't seem to be an issue in this game.  
  
Oh well, I suppose I should feel lucky never even seeing a FPS hiccup, but I wish it was optimized to run better for more people."
329,Performance delta with dedicated PhysX card?,"Check out the "" Frames v Simulation cycles' section


http://forums.bistudio.com/showthread.php?156684-Tutorial-Server-bandwidth-amp-Optimisation"
330,Looking to buy a laptop for ARMA III.,[deleted]
331,Looking to buy a laptop for ARMA III.,"I have an MSI GE60 and I play on mid-high settings, depending on server."
332,Looking to buy a laptop for ARMA III.,I haven't tried as I don't have a recent laptop but its a bit of a crap shoot with arma 3. Some peoples machines run it great others horrible. I have an i5 4430 and a gtx 760 2gb with a ssd and I barely get 60 frames in single player on very high graphics with vsync caustics and ambient occlusion off and in multiplayer the framerate is determined by the server and usually runs around 30-40 fps but sometimes dips to 5-10.. I'm not sure how it runs on laptops but I wouldn't want to be the first to try
333,Looking to buy a laptop for ARMA III.,"I can't really talk about how it will run on specifics, I play on a monster gaming PC, but I would definitely suggest something with an i7, a dedicated video card, AND as much RAM as you can get.  
  
It still may run like shit, the game is funny with performance across different hardware, but the stuff above is a good start. Personally I would say if you want to play a game like this, skip the laptop and just build a desktop if that is possible. It will be worlds cheaper than a gaming laptop anyways."
334,Looking to buy a laptop for ARMA III.,"I will upvote you for giving an actual suggestion. Don't know how true the 50-60 FPS on high statement is, but nobody else has actually given a real laptop to start looking at."
335,Looking to buy a laptop for ARMA III.,"Thanks man.  I have an older laptop so I'm looking to get a replacement.  On a good day I can run ARMA III with all the settings down (graphics low, view distance of 0 etc.) at about 25 FPS, spiking at 30 and 15 respectively.

The game looks more like [this](http://static.fjcdn.com/large/pictures/68/7b/687b24_4627130.jpg) than [this](http://www.winboard.org/artikel-attachments/67615d1376473244-arma-3-1.jpg) though.

I also commute often and don't have much living space to a laptop is key for me.  "
336,Looking to buy a laptop for ARMA III.,PM me bro! I'll give you some benchmarks and kinda show you the laptop.
337,Looking to buy a laptop for ARMA III.,"If running on a laptop is a must I highly recommend a gaming type with a fast clockspeed, good GPU and a ssd. Also be sure to check other tweaks like the cfg file in your documents/arma3 has an option for pre-rendering of frames that I changed to 1 from 1000 and it made a huge difference in the smoothness of the game"
338,Looking to buy a laptop for ARMA III.,"Will do. I am not at all interested in buying a laptop, but if there is one that performs that well on a game like Arma I would definitely keep it in mind if I am in the market for one that is Windows based."
339,Looking to buy a laptop for ARMA III.,I honestly would just give up and accept that this is the kind of game you probably don't want to be playing on a laptop.
340,Looking to buy a laptop for ARMA III.,Oh... Just realized this isn't the thread owner... Haha well if you still need anything I'm open.
341,Looking to buy a laptop for ARMA III.,It can be done if you want to spend the money lol
