,Post Title,Comments
0,/r/arma3 has merged with /r/arma,[removed]
1,/r/arma3 has merged with /r/arma,Oh my! You're welcome!
2,[Poll/Discussion] Merge /r/arma3 with /r/arma ?,Fragmentation is bad for the community. Merge 'em!
3,[Poll/Discussion] Merge /r/arma3 with /r/arma ?,Makes sense. Especially as neither subreddit has a ton of people
4,[Poll/Discussion] Merge /r/arma3 with /r/arma ?,Agreed to the merge.
5,[Poll/Discussion] Merge /r/arma3 with /r/arma ?,i think that most that are on arma3 already allso are on arma 
6,[Poll/Discussion] Merge /r/arma3 with /r/arma ?,Please merge.
7,[Poll/Discussion] Merge /r/arma3 with /r/arma ?,"It honestly a lot of sense.  Hell,  I'm subscribed to both anyways and it's pretty much the same content "
8,[Poll/Discussion] Merge /r/arma3 with /r/arma ?,"I'd say merge. Splitting the community makes no sense, /r/arma was established long before /r/arma3 came around.

So yeah, agree to merge. "
9,[Poll/Discussion] Merge /r/arma3 with /r/arma ?,I don't see why we should have two semi-active subs instead of one really active one
10,[Poll/Discussion] Merge /r/arma3 with /r/arma ?,yes please! :)
11,[Poll/Discussion] Merge /r/arma3 with /r/arma ?,"I agree on the merge, and freezing submissions seems to be the best way (so people can still look at old content, but new submissions get redirected to /r/arma). However, I think that a flair system will be needed for /r/arma, so that Life content can find a home there."
12,[Poll/Discussion] Merge /r/arma3 with /r/arma ?,"Honestly, I didn't even know this place existed until like three months ago. Never understood why we needed two subreddits."
13,[Poll/Discussion] Merge /r/arma3 with /r/arma ?,"Yes. Neither sub-reddit is active enough to warrant the separation. 


Best way I can figure to merge is to make /r/arma3 redirect to /r/arma."
14,[Poll/Discussion] Merge /r/arma3 with /r/arma ?,Is be fine with merging the 2 sub's under the condition that we continue on with the mods or r/arma. Sorry but I've seen the circlejerk of the arma3 mods (not all included) and I have no interest in that mentality here. The majority of the mods (again not all) and the general attitude of r/arma3 are the reason I'm not subbed there.
15,[Poll/Discussion] Merge /r/arma3 with /r/arma ?,I am subbed to the Arma sub and TIL there is an arma 3 one too. Merge 'em.
16,[Poll/Discussion] Merge /r/arma3 with /r/arma ?,Merge
17,[Poll/Discussion] Merge /r/arma3 with /r/arma ?,"WE MUST UNITE AS ONE, UNDER ONE BANNER, UNDER ONE SUB"
18,[Poll/Discussion] Merge /r/arma3 with /r/arma ?,I vote merge!
19,[Poll/Discussion] Merge /r/arma3 with /r/arma ?,"I support this, I did not even know about this subreddit until this topic appeared on /r/arma."
20,[Poll/Discussion] Merge /r/arma3 with /r/arma ?,Merge!
21,[Poll/Discussion] Merge /r/arma3 with /r/arma ?,Merge.
22,[Poll/Discussion] Merge /r/arma3 with /r/arma ?,merge
23,[Poll/Discussion] Merge /r/arma3 with /r/arma ?,merge
24,[Poll/Discussion] Merge /r/arma3 with /r/arma ?,Do it! 
25,[Poll/Discussion] Merge /r/arma3 with /r/arma ?,Please merge them.
26,[Poll/Discussion] Merge /r/arma3 with /r/arma ?,Another vote for merge. Cant think of a big reason not to.
27,[Poll/Discussion] Merge /r/arma3 with /r/arma ?,yes please
28,[Poll/Discussion] Merge /r/arma3 with /r/arma ?,Merge them! 
29,[Poll/Discussion] Merge /r/arma3 with /r/arma ?,Merge
30,[Poll/Discussion] Merge /r/arma3 with /r/arma ?,Merge.
31,[Poll/Discussion] Merge /r/arma3 with /r/arma ?,merge pls
32,[Poll/Discussion] Merge /r/arma3 with /r/arma ?,Please do I'm subbed to both but it would be nice to not switch between them. It sucks trying remember where you saw certain content when you wanna look it up again.
33,[Poll/Discussion] Merge /r/arma3 with /r/arma ?,"I say merge it, /r/arma is mostly arma 3 anyways. "
34,[Poll/Discussion] Merge /r/arma3 with /r/arma ?,Absolutely yes.
35,[Poll/Discussion] Merge /r/arma3 with /r/arma ?,I vote for the merger.
36,[Poll/Discussion] Merge /r/arma3 with /r/arma ?,sure!
37,[Poll/Discussion] Merge /r/arma3 with /r/arma ?,I think its a good idea.
38,[Poll/Discussion] Merge /r/arma3 with /r/arma ?,Merge!
39,[Poll/Discussion] Merge /r/arma3 with /r/arma ?,"Also subscribed to both, let's merge 'em"
40,[Poll/Discussion] Merge /r/arma3 with /r/arma ?,May as well merge em. Neither is particularly huge.
41,[Poll/Discussion] Merge /r/arma3 with /r/arma ?,Merge. Word to your mother. 
42,[Poll/Discussion] Merge /r/arma3 with /r/arma ?,Definitely merge.
43,[Poll/Discussion] Merge /r/arma3 with /r/arma ?,[deleted]
44,[Poll/Discussion] Merge /r/arma3 with /r/arma ?,Yeah I think both be merged to one as the community is quite small.
45,[Poll/Discussion] Merge /r/arma3 with /r/arma ?,Merge.
46,[Poll/Discussion] Merge /r/arma3 with /r/arma ?,Merge. 
47,[Poll/Discussion] Merge /r/arma3 with /r/arma ?,merge!
48,[Poll/Discussion] Merge /r/arma3 with /r/arma ?,"yes!

this is r/arma. it is about all the armas, not just one. so why have several? shut duwn r/arma3 and push them over here"
49,[Poll/Discussion] Merge /r/arma3 with /r/arma ?,"Definitely merge.  It's one fewer subreddit I have to subscribe to, heh."
50,[Poll/Discussion] Merge /r/arma3 with /r/arma ?,I agree with the merge but judging upvotes/downvotes for a poll is not the way to go as reddit obfuscates them in a way to confuse bots.
51,[Poll/Discussion] Merge /r/arma3 with /r/arma ?,"Did you read my infamous post about Altis Life? ;)

Merge 'em."
52,[Poll/Discussion] Merge /r/arma3 with /r/arma ?,Merge
53,[Poll/Discussion] Merge /r/arma3 with /r/arma ?,vote for merge
54,[Poll/Discussion] Merge /r/arma3 with /r/arma ?,yes
55,[Poll/Discussion] Merge /r/arma3 with /r/arma ?,Me-rge!
56,[Poll/Discussion] Merge /r/arma3 with /r/arma ?,best option is to merge
57,[Poll/Discussion] Merge /r/arma3 with /r/arma ?,Merge
58,[Poll/Discussion] Merge /r/arma3 with /r/arma ?,"merge.

also /r/arma hasa arma 3 banner /r/arma3 has arma banner.. derp"
59,[Poll/Discussion] Merge /r/arma3 with /r/arma ?,I agree. Merge.
60,[Poll/Discussion] Merge /r/arma3 with /r/arma ?,"Well, everyone has good points. I agree to merge."
61,[Poll/Discussion] Merge /r/arma3 with /r/arma ?,Merge dat chit meng.
62,[Poll/Discussion] Merge /r/arma3 with /r/arma ?,"/r/arma is for COMMUNISTS.

I DO NOT LIKE COMMUNISTS.

THEREFORE /R/ARMA3 WILL REMAIN ITS OWN SOVEREIGN, FREE SUBREDDIT."
63,[Poll/Discussion] Merge /r/arma3 with /r/arma ?,And most of them are subscribed to both
64,[Poll/Discussion] Merge /r/arma3 with /r/arma ?,"/r/arma 

*****
[^report ^a ^**problem**](http://reddit.com/r/LinkFixerBotSnr) ^| [^delete ^comment](http://www.reddit.com/message/compose?to=LinkFixerBotSnr&subject=Comment%20Deletion%20%28Parent%20Commenter%20Only%29&message=%2Bdelete+ch8ok0j) ^| [^source ^code](http://github.com/WinneonSword/LFB) ^| [^contact ^developer](http://reddit.com/user/WinneonSword)"
65,[Poll/Discussion] Merge /r/arma3 with /r/arma ?,"I'm sorry, what circlejerk? "
66,[Poll/Discussion] Merge /r/arma3 with /r/arma ?,"/r/arma 

*****
[^report ^a ^**problem**](http://reddit.com/r/LinkFixerBotSnr) ^| [^delete ^comment](http://www.reddit.com/message/compose?to=LinkFixerBotSnr&subject=Comment%20Deletion%20%28Parent%20Commenter%20Only%29&message=%2Bdelete+ch8tql4) ^| [^source ^code](http://github.com/WinneonSword/LFB) ^| [^contact ^developer](http://reddit.com/user/WinneonSword)"
67,[Poll/Discussion] Merge /r/arma3 with /r/arma ?,"from the looks its only phantom now, and he put up the post, so i wouldnt be opposed to him continuing on.
"
68,[Poll/Discussion] Merge /r/arma3 with /r/arma ?,The spam filter hurts. :(
69,[Poll/Discussion] Merge /r/arma3 with /r/arma ?,That is why the votes are supplemented with comments.
70,[Poll/Discussion] Merge /r/arma3 with /r/arma ?,Democracy is not a request.
71,Anyone know when the game will next go on sale?,"G2a.com its pretty much always on the sale.
https://www.g2a.com/arma-iii-steam-cd-key-global.html
I bought it when it was 25 euro and got my steam key within 5 minutes. No need to register and i used paypal. Btw it might be out of stock so wait for a bit and check there when it comes up. I waited like 1hr till i could buy.
EDIT: Btw on g2a now it costs 29 euro."
72,Anyone know when the game will next go on sale?,"Wouldn't be suprised if Arma III would appear in steam summer sale. Thought, I could expect sale coming July"
73,does arma 3 suppport steering wheels?,"yes it supports it as any other joystick and better now that some updates ago the analog vehicle movement was improved.


Anyways its not really that usefull unless you are going to be all the mission as driver since when you jump out the vehicle or in you may need to take the wheel and drop the mouse and its a bit troublesome, specially if you are under fire, i can assure you it can get really messy :P.


The real advantage on having a steering wheel its more on the pedals, since the analog steering with the mouse its already good if you want that kind of control. The pedals give you better control over you velocity and allow you to keep slow speeds easilly. You can also use the pedals for flying, so thats another use.

So if you already have a steering wheel and you want to test it with arma, do it. But i wont recomend you to buy it just for arma since keyboard or even mouse control(personally dont like it) its more than enough for ground vehicles."
74,does arma 3 suppport steering wheels?,Awesome.thanks for the reply
75,New patch troubleshooting,[removed]
76,How do I add mods to Zeus?,"I don't have access to the game atm but I'll try to recall from memory.

In the editor:

* Place down the ""Manage Addons"" (I think it's called that) module
* Add the names of the addons you want to include
* Sync the module to the ""Zeus Game Master"" module
* Play!

An example of the name of an addon would be ""kae_sz_infantry"" (Without quotation marks). You can find out the names of the addons by looking at the ""Addons"" folder in the directory of the mod. The addons folder should look something like [this](https://www.dropbox.com/s/yj7l9ankrg3gzjl/Screenshot%202014-05-04%2014.53.46.png)."
77,How do I add mods to Zeus?,"It depends on the what mods or scripts you would like to use. If you are using something like VAS, TAW VD, or some sort of revive script they need to be included in the mission file its self. This is usuallly done by creating a new mission and adding in the zeus module from the editor.

As for weapon and vehicle mods they should be included in the zeus mission as long as they are loaded into Arma. Most likely listed under Men -> Empty -> Other."
78,How do I add mods to Zeus?,"Gonna add a question to this, how would I host a Zeus game, I really want to play Zeus with my friend, just him and me though."
79,How do I add mods to Zeus?,"Certain mods support Zeus and are integrated into it, some are not. For instance you can drop the F-18 while in the ZEUS menu, but cannot drop other modified vehicles. It is up to the modders to include them in the ARMA structure properly, I don't understand how they do this I just know some modders add this and some don't"
80,How do I add mods to Zeus?,"I'm no expert but, i think i've read somewhere that you can't. Can't find where tho. "
81,How do I add mods to Zeus?,"I did a small mission ""Zeus Sandbox"". It's just Zeus and a Blufor Player (I did it aswell, wanted to play with my friend). If you want it, tell me and I'll upload it on dropbox or something like this."
82,How do I add mods to Zeus?,[This is the mod](http://www.armaholic.com/page.php?id=25551) I want to add. On some of the screenshots you can see that they are added into the Zeus.
83,How do I add mods to Zeus?,You can. Check my post to see how.
84,How do I add mods to Zeus?,Well I saw on screenshots that they added some wander panzer from the 'wap' mod into Zeus.
85,How do I add mods to Zeus?,Can you upload it to Steam Workshop?
86,How do I add mods to Zeus?,"I have never had to manually add a mod, they are automatically loaded when you launch Zeus. This is confusing, I would ask in the BIS thread the developer has"
87,How do I add mods to Zeus?,Thank you.
88,How do I add mods to Zeus?,"Hm...i think, there's two zeus-es...one official, and..some fan made ? Because there were scheenshots and videos on youtube of zeus stuff, before it was released, officially, right ? "
89,How do I add mods to Zeus?,"Sure. I will post link then here. Give me a second.
"
90,How do I add mods to Zeus?,"Here you go:

http://steamcommunity.com/sharedfiles/filedetails/?id=256051155"
91,"Battle Royale, which is the best gun in the mod?",depends on personal pref. i like the standard katiba since its way easier to find fitting silencers
92,"Battle Royale, which is the best gun in the mod?","The thing is to have the right scope and zeroing, having a rangefinder helps alot with this. Staying prone helps accuracy more than you can believe, if you stand upright and not aiming down the scopes you can easily take down a guy right next to you, but if you try to do the same with a guy 100 m away you'll be lucky if any of the bullets hit. I have a personal preferance with the M24 Sniper rifle. Other than that the SIG SG 550(not sure if this is the exact specific model for it) is pretty neat with the different ammo types such as armor penetration ammo and the GL attachment.
If you really want to rip up someones shit go for a machinegun, they are very good for shooting up people in cars and trucks and disabling said vehicles.

Remember, when you see the blue zone, get there as fast as possible or suffer the concequenses. Red zone isnt necessarily a death sentance, I myself have been in it several times without dying, Just stay out of the big buildings in it.

"
93,"Battle Royale, which is the best gun in the mod?","Just drove into a netting fence with a quad, and it blew up. #wat"
94,"Battle Royale, which is the best gun in the mod?","I've only found 3 katibas in the 15~games i've played
"
95,"Battle Royale, which is the best gun in the mod?","It's 'a lot' not '[alot](http://hyperboleandahalf.blogspot.com/2010/04/alot-is-better-than-you-at-everything.html),' ya dingus!"
96,"Battle Royale, which is the best gun in the mod?","English isn't my first language, you bottus. Du kan kom hit å snakk perfekt norsk hvis du vil, hysjævel."
97,A buggy mess,"Really? I went through the campaign with no problems whatsoever. Although the copy of the game I have is illegal. You could re-download the game or check cache integrity through Steam. If you installed mods, then that could be the source of the problem.


For judgmental ""anti-piracy"" people, I'm under-aged and I have no income, just for you to know."
98,A buggy mess,It's purely vanilla and I've re-installed twice already.
99,A buggy mess,"That's no excuse!

""Yeah, I killed that family in the car while I was drink-driving, but I'm not old enough to get a license, so it's ok"".

Idiot."
100,A buggy mess,Then it could be something wrong with the newer versions since what I have is an outdated one. 1.14
101,"Just purchased Arma 3, need some help","You need to enable battle royal with your launcher, I used to have this problem.  The way I installed it and play it is through playwithsix, so that automatically turns it on if I run it through the program."
102,"Just purchased Arma 3, need some help",Playwithsix is a great program for mods. Allows you to download and play pretty much any mods that out there. Also if you need any help with downloading playwithsix there are plenty of videos on YouTube for that. 
103,"Just purchased Arma 3, need some help",Got it all figured out. Thanks!
104,"Just purchased Arma 3, need some help","Ok, just download playwithSIX and run it through there?
"
105,"Just purchased Arma 3, need some help","Yep, start it up with it."
106,"I found this ""TrackIR like"" SW that uses a webcam. Settings are bit clumsy but it works. Does anybody use this?","It works sorta okay when flying, but requires a good webcam and lighting. It isn't responsive enough to be enjoyable when on foot for me though. Settings are entirely customizable, so I may just have bad settings."
107,"I found this ""TrackIR like"" SW that uses a webcam. Settings are bit clumsy but it works. Does anybody use this?","I tried this out about a year ago with Arma 2, didn't have a whole lot of luck. Spent about 4 days configing and tweaking and never getting anywhere. From what I read online it requires very specific settings (physically) to work properly. "
108,"I found this ""TrackIR like"" SW that uses a webcam. Settings are bit clumsy but it works. Does anybody use this?","I have used this and it's amazing for a free program. It can sometimes fail to recognize my face at important moments in combat though. It also has trouble with subtle movements.  

I have used this with DCS:World and a heavily modified Rfactor. Never thought to try Arma."
109,"I found this ""TrackIR like"" SW that uses a webcam. Settings are bit clumsy but it works. Does anybody use this?","Tried setting it up with Arma 3, I managed to get it working almost perfectly with a 35fps Skype certified camera (very old), but only under perfect sunlight. Even slight change and it starts wobbling around like and old drunk soldier.

I believe this works much better if you have TrackClip or make one of your own, since you can then choose that instead of face tracking and it also consumes less CPU power (face tracking is expensive)."
110,"I found this ""TrackIR like"" SW that uses a webcam. Settings are bit clumsy but it works. Does anybody use this?","Tried to set it up, worked in the config settings pretty good but ingame my character was breaking his neck and looking everywhere he shouldn't:/ gave up after a while."
111,Mohawk,[deleted]
112,Mohawk,"you can't
"
113,Mohawk,u w0t m8
114,Need Lawyer in Altis Life? Call me.,I love your rust reporter stuff!
115,Need Lawyer in Altis Life? Call me.,Did you just get arrested for speaking another language poorly?
116,Need Lawyer in Altis Life? Call me.,"Hilarious!

French accent was spot on...ish"
117,Need Lawyer in Altis Life? Call me.,"Thanks man, I'm trying my hand at Arma 3 right now until Rust gets updated more."
118,Need Lawyer in Altis Life? Call me.,Pretty much.
119,Dedicated Server Hardware review.,"My God where are you that you're paying $60 for a 10 slot server? I'm currently paying $16.60 for a 20 slot server through Vilayer, though I did get that on sale. 

As far as the specs go, I haven't run a dedicated server wtih Arma 3 yet, but I use to run 3 DayZ servers on a 2.7GHz Xeon Quad Core w/ 4GB Ram and a 500GB Hard Drive. On top of the DayZ servers we ran our website (With custom Admin tools) and mumble from this dedicated server."
120,Dedicated Server Hardware review.,"I don't want to go shaming my host publicly.
Aside from their lucrative pricing scheme, they have been ""very"" accommodating and ultra responsive. 
It's simply just too expensive over the long term.
And even at 20$ a month, with a title like Arma and its likely 10 year life cycle, it's not hard to justify an investment in hardware.

My problem lies in that when I go to a website that does CPU performance benchmark comparisons, the numbers don't look promising on the Xeon front. 
They seem to perform an astoundingly low number of calculations in relation to their modern counterparts. Even a dual quad server would be significantly slower performance wise than a single modern dual core.
Perhaps I don't really understand what I'm reading in terms of how it relates to everyday performance. They are after all just arbitrary numbers!
So I still really don't know if a modern desktop style PC would indeed be the wisest decision performance and consolidation wise.
Its just that those old Xeon servers are just so damn cheap now!
Much cheaper than what parting a completely new box out is going to cost.

http://www.cpubenchmark.net/cpu_list.php



 "
121,"New to Arma 3. What are some ESSENTIAL settings to change to improve performance, mods to download et cetera.",[deleted]
122,"New to Arma 3. What are some ESSENTIAL settings to change to improve performance, mods to download et cetera.","Nothing is really required. I have put over 500 hours into A3 and still use mostly vanilla. Most settings are trial and error for your system. Everyone is different and A3 can be finicky at best.

Get it running well enough and then put a few hours in. After that you can get your settings top notch. 

Mods? Maybe look at acre, mcc and anything else that takes your fancy on armaholic. "
123,"New to Arma 3. What are some ESSENTIAL settings to change to improve performance, mods to download et cetera.",Are you having performance issues? What processor/GPU do you have?
124,"New to Arma 3. What are some ESSENTIAL settings to change to improve performance, mods to download et cetera.",Battle Royale is a must. Play with settings until they work good on your machine. With6 is awesome as well.
125,"New to Arma 3. What are some ESSENTIAL settings to change to improve performance, mods to download et cetera.","-nosplash -world=empty -skipIntro -maxMem=2047 -maxVRAM=2047 -cpuCount=xx -exThreads=xx -malloc=system -noLogs -noPause -mod

https://community.bistudio.com/wiki/Arma_3_Startup_Parameters

Edit: Added xx on places where it should be configured to user specific hardware"
126,"New to Arma 3. What are some ESSENTIAL settings to change to improve performance, mods to download et cetera.","Didnt know about the shadows thing but changing from normal to ultra just gained me about 3-4 fps, thanks!"
127,"New to Arma 3. What are some ESSENTIAL settings to change to improve performance, mods to download et cetera.","I definately would keep headbobbing on as otherwise it takes a lot of the athmosphere and immersion of the game. Also, shadows on ULTRA are way faster than shadows on VERY HIGH, at least on my machine."
128,"New to Arma 3. What are some ESSENTIAL settings to change to improve performance, mods to download et cetera.",Thanks man. That was very informative.
129,"New to Arma 3. What are some ESSENTIAL settings to change to improve performance, mods to download et cetera.",[deleted]
130,"New to Arma 3. What are some ESSENTIAL settings to change to improve performance, mods to download et cetera.","Just posting for future reference
"
131,"New to Arma 3. What are some ESSENTIAL settings to change to improve performance, mods to download et cetera.","I'd love to turn V-Sync off, but I get mad screen tearing when I do. I usually run at 1080p on one of those Korean 2560x1440 panels.  The screen looks great, but doesn't handle motion spectacularly, or perhaps I'm just very sensitive to screen tearing.

"
132,"New to Arma 3. What are some ESSENTIAL settings to change to improve performance, mods to download et cetera.",Ughh. I'm not to sure on JSRS. It sounds good and all but it seems to mess up directional sound. I'd recommend [ACSE](http://bit.ly/1g0sH5C) instead.
133,"New to Arma 3. What are some ESSENTIAL settings to change to improve performance, mods to download et cetera.",Commenting to save.
134,"New to Arma 3. What are some ESSENTIAL settings to change to improve performance, mods to download et cetera.",Thanks for the reply man
135,"New to Arma 3. What are some ESSENTIAL settings to change to improve performance, mods to download et cetera.",I haven't bought the game yet. I just want to understand all the current problems and fixes for them so I don't encounter un-solvable problems from the get go.
136,"New to Arma 3. What are some ESSENTIAL settings to change to improve performance, mods to download et cetera.",Dont just copy/paste these in. They are specifically for his pc and may bottleneck yours. Check out https://community.bistudio.com/wiki/Arma_3_Startup_Parameters
137,"New to Arma 3. What are some ESSENTIAL settings to change to improve performance, mods to download et cetera.",Appreciated guys.
138,"New to Arma 3. What are some ESSENTIAL settings to change to improve performance, mods to download et cetera.",That alone makes the post worth it then.  
139,"New to Arma 3. What are some ESSENTIAL settings to change to improve performance, mods to download et cetera.","Yeah, it's definately a preference thing.  Unfortunately for a lot of people who are prone to motion sickness, it can cause some issues. 

For me, it's nothing like that.  It's just too damn annoying.  It seems like every time I show people where the setting is at, I hear sighs of relief over TS. "
140,"New to Arma 3. What are some ESSENTIAL settings to change to improve performance, mods to download et cetera.","Also, the best thing you can do for Arma performance is to invest in an SSD.  The RV engine relies heavily on HDD texture streaming to render it's insanely massive worlds.  So the faster your disk drive is, the faster it will load those textures in, preventing the most extreme cases of LOD pop, drastically lowering your load times, and most importantly, raising your average MinimumFPS, providing an overall smoother experience. "
141,"New to Arma 3. What are some ESSENTIAL settings to change to improve performance, mods to download et cetera.","A few of them do.  Specifically, the improved ragdoll, the real armor, the refined vehicles, and Tao's Modular Realism.  With TMR though, there is a client side only version that you can find here: http://www.armaholic.com/page.php?id=25369

If you're interested in MP with mods, quite a few popular servers allow the use of client side only mods.  Here's a list of client side only mods that we allow on our server for reference: http://torsquad.com/modules.php?name=Forums&file=viewtopic&t=2755"
142,"New to Arma 3. What are some ESSENTIAL settings to change to improve performance, mods to download et cetera.","Just so you know, you can save comments on reddit without gold now. Although some mobile apps probably don't support out, most do afaik."
